{
  "root_path": "/home/dev/projects/myapp",
  "git": {
    "remote_url": "https://github.com/ola/myapp.git",
    "branch": "feature/signup-validation",
    "commit_sha": "a1b2c3d4e5f6a1b2c3d4e5f6a1b2c3d4e5f6a1b2",
    "commit_message": "Add signup endpoint scaffold",
    "dirty": false
  },
  "files": [
    {
      "path": "src/api/auth.py",
      "sha256": "e3b0c44298fc1c149afbf4c8996fb92427ae41e4649b934ca495991b7852b855",
      "size_bytes": 312,
      "role": "edited"
    },
    {
      "path": "tests/test_auth.py",
      "sha256": null,
      "size_bytes": 540,
      "role": "created"
    }
  ],
  "environment": {
    "os": "darwin",
    "os_version": "Darwin 23.6.0",
    "shell": "bash",
    "languages": {
      "python": "3.12.1"
    },
    "venv_path": ".venv"
  }
}
